{
  "id": "example-video-embed",
  "type": "video",
  "display_mode": "video_embed",
  "url": null,
  "thumbnail_url": "https://img.example.com/vi/example-video-001/mqdefault.jpg",
  "thumbnail_width": 320,
  "thumbnail_height": 180,
  "video_sources": null,
  "duration_seconds": 117,
  "embed_url": "https://player.example.com/embed/example-video-001?playsinline=1&rel=0",
  "provider": "example",
  "render": null,
  "link_only_reason": null,
  "source_name": "Example 공식 채널",
  "source_url": "https://video.example.com/watch?v=example-video-001",
  "license": "provider-terms",
  "license_status": "other",
  "license_url": "https://video.example.com/terms",
  "attribution": "Example 공식 채널 · Example Video",
  "description": "시험용 개막식 영상 설명",
  "captured_at": "1986",
  "date_precision": "year",
  "lat": null,
  "lng": null,
  "place_ref": "country:KR",
  "retrieved_at": "2026-10-13T03:00:00Z"
}
