{
  "id": "commons-129150318",
  "type": "photo",
  "display_mode": "image",
  "url": "https://upload.wikimedia.org/wikipedia/commons/c/cf/2002%EB%85%84_%ED%95%9C%C2%B7%EC%9D%BC_%EC%9B%94%EB%93%9C%EC%BB%B5-%EB%8C%80%ED%95%9C%EB%AF%BC%EA%B5%AD%C2%B7%EC%8A%A4%ED%8E%98%EC%9D%B8_8%EA%B0%95_%EA%B2%BD%EA%B8%B0-%EA%B2%BD%EA%B8%B0%EC%9E%A5_%EC%A0%84%EA%B2%BD.jpg",
  "thumbnail_url": "https://thumb.wikimedia.org/wikipedia/commons/thumb/c/cf/2002%EB%85%84_%ED%95%9C%C2%B7%EC%9D%BC_%EC%9B%94%EB%93%9C%EC%BB%B5-%EB%8C%80%ED%95%9C%EB%AF%BC%EA%B5%AD%C2%B7%EC%8A%A4%ED%8E%98%EC%9D%B8_8%EA%B0%95_%EA%B2%BD%EA%B8%B0-%EA%B2%BD%EA%B8%B0%EC%9E%A5_%EC%A0%84%EA%B2%BD.jpg/960px-2002%EB%85%84_%ED%95%9C%C2%B7%EC%9D%BC_%EC%9B%94%EB%93%9C%EC%BB%B5-%EB%8C%80%ED%95%9C%EB%AF%BC%EA%B5%AD%C2%B7%EC%8A%A4%ED%8E%98%EC%9D%B8_8%EA%B0%95_%EA%B2%BD%EA%B8%B0-%EA%B2%BD%EA%B8%B0%EC%9E%A5_%EC%A0%84%EA%B2%BD.jpg",
  "thumbnail_width": 640,
  "thumbnail_height": 422,
  "video_sources": null,
  "duration_seconds": null,
  "embed_url": null,
  "provider": null,
  "render": null,
  "link_only_reason": null,
  "source_name": "Wikimedia Commons",
  "source_url": "https://commons.wikimedia.org/wiki/File:2002%EB%85%84_%ED%95%9C%C2%B7%EC%9D%BC_%EC%9B%94%EB%93%9C%EC%BB%B5-%EB%8C%80%ED%95%9C%EB%AF%BC%EA%B5%AD%C2%B7%EC%8A%A4%ED%8E%98%EC%9D%B8_8%EA%B0%95_%EA%B2%BD%EA%B8%B0-%EA%B2%BD%EA%B8%B0%EC%9E%A5_%EC%A0%84%EA%B2%BD.jpg",
  "license": "KOGL Type 1",
  "license_status": "free",
  "license_url": "http://www.kogl.or.kr/info/licenseType1.do",
  "attribution": "문덕관 기증 · 국립민속박물관 민속아카이브 · 공공누리 제1유형 출처 표시 (KOGL Type 1) · Wikimedia Commons",
  "description": "2002년 한·일 월드컵 중 대한민국과 스페인의 8강 경기 중 촬영한 광주 월드컵 경기장 내부의 전경 및 관중들의 모습",
  "captured_at": "2002-06-22",
  "date_precision": "day",
  "lat": null,
  "lng": null,
  "place_ref": "country:KR",
  "retrieved_at": "2026-10-13T23:51:32Z"
}
