{
  "id": "example-image-embed",
  "type": "photo",
  "display_mode": "image_embed",
  "url": null,
  "thumbnail_url": null,
  "thumbnail_width": 594,
  "thumbnail_height": 396,
  "video_sources": null,
  "duration_seconds": null,
  "embed_url": "https://embed.example.com/image/example-asset-001",
  "provider": "example",
  "render": null,
  "link_only_reason": null,
  "source_name": "Example Images",
  "source_url": "https://images.example.com/detail/example-asset-001",
  "license": "provider-terms",
  "license_status": "other",
  "license_url": "https://images.example.com/terms",
  "attribution": "Example Images 공식 퍼가기",
  "description": "시험용 제공사 이미지 임베드 설명",
  "captured_at": "2002-06-22",
  "date_precision": "day",
  "lat": null,
  "lng": null,
  "place_ref": "country:KR",
  "retrieved_at": "2026-10-13T03:00:00Z"
}
