{
  "id": "example-video-file",
  "type": "video",
  "display_mode": "video_file",
  "url": null,
  "thumbnail_url": "https://media.example.org/thumbs/640px-example-video-1988.jpg",
  "thumbnail_width": 640,
  "thumbnail_height": 360,
  "video_sources": [
    { "url": "https://media.example.org/transcoded/example-video-1988.360p.webm", "mime": "video/webm", "height": 360 },
    { "url": "https://media.example.org/transcoded/example-video-1988.480p.webm", "mime": "video/webm", "height": 480 }
  ],
  "duration_seconds": 95.5,
  "embed_url": null,
  "provider": null,
  "render": null,
  "link_only_reason": null,
  "source_name": "Example Archive",
  "source_url": "https://archive.example.org/items/example-video-1988",
  "license": "CC BY-SA 4.0",
  "license_status": "free",
  "license_url": "https://creativecommons.org/licenses/by-sa/4.0/",
  "attribution": "Example Filmmaker · CC BY-SA 4.0 · Example Archive",
  "description": "시험용 영상 설명",
  "captured_at": "1988-09",
  "date_precision": "month",
  "lat": null,
  "lng": null,
  "place_ref": "country:KR",
  "retrieved_at": "2026-10-13T03:00:00Z"
}
