{
  "id": "example-photo-license-unknown",
  "type": "photo",
  "display_mode": "image",
  "url": "https://media.example.org/files/example-photo-1988.jpg",
  "thumbnail_url": "https://media.example.org/thumbs/640px-example-photo-1988.jpg",
  "thumbnail_width": 640,
  "thumbnail_height": 427,
  "video_sources": null,
  "duration_seconds": null,
  "embed_url": null,
  "provider": null,
  "render": null,
  "link_only_reason": null,
  "source_name": "Example Archive",
  "source_url": "https://archive.example.org/items/example-photo-1988",
  "license": null,
  "license_status": "unknown",
  "license_url": null,
  "attribution": "작가 정보 없음 · 라이선스 확인 안 됨 · Example Archive",
  "description": "시험용 사진 설명 (라이선스 미확인)",
  "captured_at": "1988-09-17",
  "date_precision": "day",
  "lat": null,
  "lng": null,
  "place_ref": "country:KR",
  "retrieved_at": "2026-10-13T03:00:00Z"
}
