{
  "id": "example-sdk",
  "type": "streetview",
  "display_mode": "sdk",
  "url": null,
  "thumbnail_url": null,
  "thumbnail_width": null,
  "thumbnail_height": null,
  "video_sources": null,
  "duration_seconds": null,
  "embed_url": null,
  "provider": "example",
  "render": { "provider": "example", "kind": "roadview", "lat": 37.5665, "lng": 126.978, "zoom": null },
  "link_only_reason": null,
  "source_name": "Example Maps",
  "source_url": "https://maps.example.com/",
  "license": "provider-terms",
  "license_status": "other",
  "license_url": "https://maps.example.com/terms",
  "attribution": "Example Maps",
  "description": "시험용 거리 화면 설명 (현재 모습)",
  "captured_at": null,
  "date_precision": "current",
  "lat": 37.5665,
  "lng": 126.978,
  "place_ref": null,
  "retrieved_at": "2026-10-13T03:00:00Z"
}
