{
  "id": "example-link-only",
  "type": "photo",
  "display_mode": "link_only",
  "url": null,
  "thumbnail_url": null,
  "thumbnail_width": null,
  "thumbnail_height": null,
  "video_sources": null,
  "duration_seconds": null,
  "embed_url": null,
  "provider": null,
  "render": null,
  "link_only_reason": "hotlink_blocked",
  "source_name": "Example Archive",
  "source_url": "https://archive.example.org/items/example-photo-2000",
  "license": null,
  "license_status": "unknown",
  "license_url": null,
  "attribution": "작가 정보 없음 · 라이선스 확인 안 됨 · Example Archive",
  "description": "시험용 사진 설명 (원 출처가 핫링크를 막음)",
  "captured_at": "2000-02-29",
  "date_precision": "day",
  "lat": null,
  "lng": null,
  "place_ref": "unknown",
  "retrieved_at": "2026-10-13T03:00:00Z"
}
