{
  "id": "example-photo-capture-time-unknown",
  "type": "photo",
  "display_mode": "image",
  "url": "https://media.example.org/files/example-photo-undated.jpg",
  "thumbnail_url": "https://media.example.org/thumbs/640px-example-photo-undated.jpg",
  "thumbnail_width": 640,
  "thumbnail_height": 480,
  "video_sources": null,
  "duration_seconds": null,
  "embed_url": null,
  "provider": null,
  "render": null,
  "link_only_reason": null,
  "source_name": "Example Archive",
  "source_url": "https://archive.example.org/items/example-photo-undated",
  "license": "CC BY 4.0",
  "license_status": "free",
  "license_url": "https://creativecommons.org/licenses/by/4.0/",
  "attribution": "Example Photographer · CC BY 4.0 · Example Archive",
  "description": "시험용 사진 설명 (촬영 시점 미상)",
  "captured_at": null,
  "date_precision": null,
  "lat": null,
  "lng": null,
  "place_ref": "world",
  "retrieved_at": "2026-10-13T03:00:00Z"
}
