{
  "id": "example-photo-approx",
  "type": "aerial",
  "display_mode": "image",
  "url": "https://media.example.org/files/example-aerial-c1988.jpg",
  "thumbnail_url": "https://media.example.org/thumbs/640px-example-aerial-c1988.jpg",
  "thumbnail_width": 640,
  "thumbnail_height": 640,
  "video_sources": null,
  "duration_seconds": null,
  "embed_url": null,
  "provider": null,
  "render": null,
  "link_only_reason": null,
  "source_name": "Example Archive",
  "source_url": "https://archive.example.org/items/example-aerial-c1988",
  "license": "KOGL Type 1",
  "license_status": "free",
  "license_url": "http://www.kogl.or.kr/info/licenseType1.do",
  "attribution": "Example Agency · KOGL Type 1 · Example Archive",
  "description": "시험용 항공사진 설명 (c. 1988)",
  "captured_at": "1988",
  "date_precision": "approx",
  "lat": 37.5665,
  "lng": 126.978,
  "place_ref": null,
  "retrieved_at": "2026-10-13T03:00:00Z"
}
