{
  "id": "commons-4930021",
  "type": "photo",
  "display_mode": "image",
  "url": "https://upload.wikimedia.org/wikipedia/commons/1/18/1988_Summer_Olympics_opening_ceremony.JPEG",
  "thumbnail_url": "https://thumb.wikimedia.org/wikipedia/commons/thumb/1/18/1988_Summer_Olympics_opening_ceremony.JPEG/960px-1988_Summer_Olympics_opening_ceremony.JPEG",
  "thumbnail_width": 640,
  "thumbnail_height": 955,
  "video_sources": null,
  "duration_seconds": null,
  "embed_url": null,
  "provider": null,
  "render": null,
  "link_only_reason": null,
  "source_name": "Wikimedia Commons",
  "source_url": "https://commons.wikimedia.org/wiki/File:1988_Summer_Olympics_opening_ceremony.JPEG",
  "license": "Public domain",
  "license_status": "free",
  "license_url": null,
  "attribution": "Ken Hackman, U.S. Air Force · Public domain · Wikimedia Commons",
  "description": "제24회 하계 올림픽(1988년 서울) 개막식에서 화려한 의상을 입은 한국인이 깃발을 들고 있다",
  "captured_at": "1988-09-17",
  "date_precision": "day",
  "lat": null,
  "lng": null,
  "place_ref": "country:KR",
  "retrieved_at": "2026-10-13T23:51:32Z"
}
